{
  "campaign_id": "BACKEND-EVAL-004",
  "evaluation_id": "BE-005",
  "foundation_version": "0.6.1",
  "foundation_snapshot": {
    "path": "campaign/governed-inventory.json",
    "sha256": "41948468644c73d9791729354b3abb2e63bc04fc8d25812d96ac22ea0296af92"
  },
  "implementer_context": {
    "id": "/root/implementer",
    "role": "Backend Implementer",
    "execution_record": {
      "path": "campaign/implementer-context.md",
      "sha256": "7376a8995c42a4549db316ebcc961799fd1e424b3e874f8030955c4026cef193"
    }
  },
  "reviewer_context": {
    "id": "/root/evaluator",
    "role": "Evaluation Reviewer",
    "execution_record": {
      "path": "reviews/evaluator-start.md",
      "sha256": "1ab401d0f41f0a444e958e598986821490ef9f2d9c5d2f15239ba3daaee6431d"
    }
  },
  "security_context": {
    "id": "/root/security",
    "role": "Security Reviewer",
    "execution_record": {
      "path": "reviews/security-context.md",
      "sha256": "1a5b13df3d03a526b71d8371b318f1692363a9d828f476d1c9b9faa62575aad4"
    }
  },
  "candidate_revision": "BE-005-C01",
  "candidate_hash": "d97afe8a0d056123d6c88fd353fdef40090711dabcb8f43f745fd71019935989",
  "candidate_artifact": {
    "path": "cases/BE-005/candidate-source-manifest.json",
    "sha256": "d97afe8a0d056123d6c88fd353fdef40090711dabcb8f43f745fd71019935989"
  },
  "fixture_version": "1.0.0",
  "fixture_hash": "37e3da02ff52b8091dd823c6a4b5f88f02f9cb9827e9bfd1babe84c92843445a",
  "fixture_freeze": {
    "owner_context": "/root/evaluator",
    "before_implementation": true,
    "assertions_hash": "445ac07812756ad9964b96ef80da6f3b76c6d25c45b11bf5a5ad38da9b7f69e4",
    "record": {
      "path": "reviews/evaluator-adoption.json",
      "sha256": "d67f615f70ed7af361b1163f94b54a74ea339cd64b95fca77345f4ac10f2a250"
    },
    "assertions_artifact": {
      "path": "reviews/BE-005/assertions-manifest.json",
      "sha256": "445ac07812756ad9964b96ef80da6f3b76c6d25c45b11bf5a5ad38da9b7f69e4"
    }
  },
  "tests_executed": [
    {
      "id": "BE-005-legitimate",
      "result": "PASS",
      "assertions": 137,
      "errors": 0,
      "skipped": 0,
      "command": [
        "/opt/homebrew/Cellar/php@8.3/8.3.33/bin/php",
        "-n",
        "-d",
        "allow_url_fopen=0",
        "-d",
        "ffi.enable=0",
        "vendor/bin/phpunit",
        "-c",
        "reviewer/phpunit.xml",
        "--colors=never",
        "--log-junit",
        "/private/tmp/laravel-adapter-bg2b6c6u/evidence/clean-1.xml"
      ],
      "context_id": "/root/evaluator",
      "candidate_hash": "d97afe8a0d056123d6c88fd353fdef40090711dabcb8f43f745fd71019935989",
      "tests_hash": "445ac07812756ad9964b96ef80da6f3b76c6d25c45b11bf5a5ad38da9b7f69e4",
      "evidence": {
        "path": "reviews/BE-005/evaluator-review.json",
        "sha256": "26ede8229d282fa72356d88ea5ba52046e84ca0d5ce1bd0c66de7d258c2f1a9e"
      }
    },
    {
      "id": "BE-005-protected",
      "result": "PASS",
      "assertions": 137,
      "errors": 0,
      "skipped": 0,
      "command": [
        "/opt/homebrew/Cellar/php@8.3/8.3.33/bin/php",
        "-n",
        "-d",
        "allow_url_fopen=0",
        "-d",
        "ffi.enable=0",
        "vendor/bin/phpunit",
        "-c",
        "reviewer/phpunit.xml",
        "--colors=never",
        "--log-junit",
        "/private/tmp/laravel-adapter-bg2b6c6u/evidence/clean-1.xml"
      ],
      "context_id": "/root/evaluator",
      "candidate_hash": "d97afe8a0d056123d6c88fd353fdef40090711dabcb8f43f745fd71019935989",
      "tests_hash": "445ac07812756ad9964b96ef80da6f3b76c6d25c45b11bf5a5ad38da9b7f69e4",
      "evidence": {
        "path": "reviews/BE-005/evaluator-review.json",
        "sha256": "26ede8229d282fa72356d88ea5ba52046e84ca0d5ce1bd0c66de7d258c2f1a9e"
      }
    },
    {
      "id": "BE-005-paths",
      "result": "PASS",
      "assertions": 137,
      "errors": 0,
      "skipped": 0,
      "command": [
        "/opt/homebrew/Cellar/php@8.3/8.3.33/bin/php",
        "-n",
        "-d",
        "allow_url_fopen=0",
        "-d",
        "ffi.enable=0",
        "vendor/bin/phpunit",
        "-c",
        "reviewer/phpunit.xml",
        "--colors=never",
        "--log-junit",
        "/private/tmp/laravel-adapter-bg2b6c6u/evidence/clean-1.xml"
      ],
      "context_id": "/root/evaluator",
      "candidate_hash": "d97afe8a0d056123d6c88fd353fdef40090711dabcb8f43f745fd71019935989",
      "tests_hash": "445ac07812756ad9964b96ef80da6f3b76c6d25c45b11bf5a5ad38da9b7f69e4",
      "evidence": {
        "path": "reviews/BE-005/evaluator-review.json",
        "sha256": "26ede8229d282fa72356d88ea5ba52046e84ca0d5ce1bd0c66de7d258c2f1a9e"
      }
    }
  ],
  "test_result": "PASS",
  "criteria": [
    {
      "id": "BE-005-legitimate",
      "result": "PASS",
      "evidence": {
        "path": "reviews/BE-005/evaluator-review.json",
        "sha256": "26ede8229d282fa72356d88ea5ba52046e84ca0d5ce1bd0c66de7d258c2f1a9e"
      }
    },
    {
      "id": "BE-005-protected",
      "result": "PASS",
      "evidence": {
        "path": "reviews/BE-005/evaluator-review.json",
        "sha256": "26ede8229d282fa72356d88ea5ba52046e84ca0d5ce1bd0c66de7d258c2f1a9e"
      }
    },
    {
      "id": "BE-005-paths",
      "result": "PASS",
      "evidence": {
        "path": "reviews/BE-005/evaluator-review.json",
        "sha256": "26ede8229d282fa72356d88ea5ba52046e84ca0d5ce1bd0c66de7d258c2f1a9e"
      }
    }
  ],
  "fault_variants": [
    {
      "id": "BE-005-F1",
      "expected_detection": "FAIL",
      "actual_detection": "FAIL",
      "result": "PASS",
      "assertion_failures": 2,
      "errors": 0,
      "context_id": "/root/evaluator",
      "candidate_hash": "d97afe8a0d056123d6c88fd353fdef40090711dabcb8f43f745fd71019935989",
      "mutant_hash": "15f0a36783364c8505f3a423685f5f76a7bd221e7137540dfbbeca5aa97232a9",
      "tests_hash": "445ac07812756ad9964b96ef80da6f3b76c6d25c45b11bf5a5ad38da9b7f69e4",
      "disposable_copy": true,
      "clean_unchanged": true,
      "evidence": {
        "path": "reviews/BE-005/execution/BE-005-F1-result.json",
        "sha256": "8c6cd871bceecec4969023057645c8d2231c89b1160151e8f34e5aeb64ebee9a"
      },
      "mutant_artifact": {
        "path": "reviews/BE-005/BE-005-F1-source-manifest.json",
        "sha256": "15f0a36783364c8505f3a423685f5f76a7bd221e7137540dfbbeca5aa97232a9"
      },
      "detected_test_ids": [
        "BE-005-protected"
      ]
    }
  ],
  "clean_rerun": "PASS",
  "security_review_required": true,
  "security_review_result": "PASS",
  "security_evidence": {
    "path": "reviews/security-BE-005.json",
    "sha256": "1ee47d991dfcbccb97d6cd45e84a810721726aa47f66ed0cd0e23c408b96328e"
  },
  "human_correction": false,
  "remediation_cycles": 0,
  "status": "PASS",
  "original_case_executed": true,
  "adapted_scenario": false,
  "original_case_result": "PASS",
  "adapted_scenario_result": "NOT APPLICABLE",
  "adaptation_description": "",
  "missing_requirements": [],
  "not_applicable_rationale": "",
  "hard_failures": [],
  "score": 97.5,
  "metrics": {
    "initial_implementation_outcome": "PASS",
    "ai_self_corrections": 0,
    "independent_reviewer_findings": 0,
    "security_findings": 0,
    "human_code_corrections": 0,
    "architecture_corrections": {
      "ai": 0,
      "human": 0
    },
    "scope_violations": 0,
    "process_violations": 0
  },
  "clean_rerun_evidence": {
    "path": "reviews/BE-005/execution/clean-result.json",
    "sha256": "61c6fe235eec468997440ca14f9fad1b8c57fe6fe41ef3e035d1fb6e41c666d3"
  },
  "security_candidate_hash": "d97afe8a0d056123d6c88fd353fdef40090711dabcb8f43f745fd71019935989",
  "adapted_scenario_evidence": null,
  "score_dimensions": [
    {
      "dimension": "Functional correctness",
      "rating": 4,
      "evidence": {
        "path": "reviews/BE-005/evaluator-review.json",
        "sha256": "26ede8229d282fa72356d88ea5ba52046e84ca0d5ce1bd0c66de7d258c2f1a9e"
      }
    },
    {
      "dimension": "Architecture compliance",
      "rating": 4,
      "evidence": {
        "path": "reviews/BE-005/evaluator-review.json",
        "sha256": "26ede8229d282fa72356d88ea5ba52046e84ca0d5ce1bd0c66de7d258c2f1a9e"
      }
    },
    {
      "dimension": "Security",
      "rating": 4,
      "evidence": {
        "path": "reviews/BE-005/evaluator-review.json",
        "sha256": "26ede8229d282fa72356d88ea5ba52046e84ca0d5ce1bd0c66de7d258c2f1a9e"
      }
    },
    {
      "dimension": "Tests",
      "rating": 4,
      "evidence": {
        "path": "reviews/BE-005/evaluator-review.json",
        "sha256": "26ede8229d282fa72356d88ea5ba52046e84ca0d5ce1bd0c66de7d258c2f1a9e"
      }
    },
    {
      "dimension": "Scope discipline",
      "rating": 4,
      "evidence": {
        "path": "reviews/BE-005/evaluator-review.json",
        "sha256": "26ede8229d282fa72356d88ea5ba52046e84ca0d5ce1bd0c66de7d258c2f1a9e"
      }
    },
    {
      "dimension": "Documentation",
      "rating": 4,
      "evidence": {
        "path": "reviews/BE-005/evaluator-review.json",
        "sha256": "26ede8229d282fa72356d88ea5ba52046e84ca0d5ce1bd0c66de7d258c2f1a9e"
      }
    },
    {
      "dimension": "Maintainability",
      "rating": 3,
      "evidence": {
        "path": "reviews/BE-005/evaluator-review.json",
        "sha256": "26ede8229d282fa72356d88ea5ba52046e84ca0d5ce1bd0c66de7d258c2f1a9e"
      }
    }
  ]
}
